{
  "schema_version": 1,
  "run_id": "manual-01",
  "base_url": "http://127.0.0.1:4010",
  "alternatives": [
    {
      "index": 0,
      "schemes": [
        {
          "scheme": "steelApiKey",
          "type": "apiKey",
          "location": "header",
          "wire_name": "steel-api-key",
          "environment": "OAL_AUTH_STEELAPIKEY",
          "value": "SYNTHETIC_SECRET_VALUE"
        }
      ]
    }
  ]
}
